{"accessible_partition":["E0","E1","E2","E3","A0","A1","A2","A3","A4","A5","A6","A7"],"allowed_gates":["H","S","X","Z","CNOT"],"ancilla_initial_stabilizers":[{"operators":"XIIIXIII","phase_exponent_mod_4":0,"qubit_order":["B0","B1","B2","B3","E0","E1","E2","E3"]},{"operators":"ZIIIZIII","phase_exponent_mod_4":0,"qubit_order":["B0","B1","B2","B3","E0","E1","E2","E3"]},{"operators":"IXIIIXII","phase_exponent_mod_4":0,"qubit_order":["B0","B1","B2","B3","E0","E1","E2","E3"]},{"operators":"IZIIIZII","phase_exponent_mod_4":0,"qubit_order":["B0","B1","B2","B3","E0","E1","E2","E3"]},{"operators":"IIXIIIXI","phase_exponent_mod_4":0,"qubit_order":["B0","B1","B2","B3","E0","E1","E2","E3"]},{"operators":"IIZIIIZI","phase_exponent_mod_4":0,"qubit_order":["B0","B1","B2","B3","E0","E1","E2","E3"]},{"operators":"IIIXIIIX","phase_exponent_mod_4":0,"qubit_order":["B0","B1","B2","B3","E0","E1","E2","E3"]},{"operators":"IIIZIIIZ","phase_exponent_mod_4":0,"qubit_order":["B0","B1","B2","B3","E0","E1","E2","E3"]}],"ancilla_qubits":["B0","B1","B2","B3","E0","E1","E2","E3"],"certification_thresholds":{"numerical_tolerance":"1e-12"},"channel_input":["A0","A1","A2","A3","A4","A5","A6","A7"],"choi_convention":"normalized_bell_source_order_output_reference_environment","coupling_graph":{"directed":false,"edges":[["A0","A1"],["A0","E3"],["A1","A2"],["A2","A3"],["A3","A4"],["A4","A5"],["A5","A6"],["A6","A7"],["E0","E1"],["E1","E2"],["E2","E3"]],"native_two_qubit_gate":"CNOT","sites":["E0","E1","E2","E3","A0","A1","A2","A3","A4","A5","A6","A7"]},"depth_convention":"asap_two_qubit_layers_single_qubit_free","expected_tau_support":[],"format_version":"orelia.recovery-problem/v1","inaccessible_partition":["B0","B1","B2","B3"],"logical_qubit_order":["A0","A1","A2","A3","A4","A5","A6","A7"],"metadata":[["adapter","hayden_preskill_toy"],["architecture","chain"],["emission_time","8"],["fixture_id","a8"],["scramble_depth","6"],["seed","20260802"]],"petz_reference":"maximally_mixed_on_channel_input","physical_initial_order":["E0","E1","E2","E3","A0","A1","A2","A3","A4","A5","A6","A7"],"qubit_order":["A0","A1","A2","A3","A4","A5","A6","A7","B0","B1","B2","B3","E0","E1","E2","E3"],"requested_output":["E0","E1","E2","E3","A0","A1","A2","A3"],"router":{"algorithm":"common_lookahead_token_restore","candidate_budget":64,"lookahead":16,"restore_final_order":true},"source_clifford":[{"operation":"H","qubits":["A0"]},{"operation":"H","qubits":["A1"]},{"operation":"S","qubits":["A2"]},{"operation":"S","qubits":["A3"]},{"operation":"H","qubits":["A4"]},{"operation":"H","qubits":["A5"]},{"operation":"S","qubits":["A6"]},{"operation":"S","qubits":["A7"]},{"operation":"S","qubits":["B0"]},{"operation":"S","qubits":["B1"]},{"operation":"H","qubits":["B2"]},{"operation":"H","qubits":["B3"]},{"operation":"CNOT","qubits":["B1","A1"]},{"operation":"CNOT","qubits":["B0","A3"]},{"operation":"CNOT","qubits":["B3","B2"]},{"operation":"CNOT","qubits":["A4","A6"]},{"operation":"CNOT","qubits":["A0","A2"]},{"operation":"CNOT","qubits":["A5","A7"]},{"operation":"S","qubits":["B1"]},{"operation":"H","qubits":["A1"]},{"operation":"H","qubits":["B0"]},{"operation":"S","qubits":["A3"]},{"operation":"H","qubits":["B3"]},{"operation":"S","qubits":["B2"]},{"operation":"H","qubits":["A4"]},{"operation":"H","qubits":["A6"]},{"operation":"S","qubits":["A0"]},{"operation":"H","qubits":["A2"]},{"operation":"S","qubits":["A5"]},{"operation":"S","qubits":["A7"]},{"operation":"CNOT","qubits":["B2","A6"]},{"operation":"CNOT","qubits":["A0","A1"]},{"operation":"CNOT","qubits":["A7","A4"]},{"operation":"CNOT","qubits":["A5","A2"]},{"operation":"CNOT","qubits":["B0","B3"]},{"operation":"CNOT","qubits":["B1","A3"]},{"operation":"S","qubits":["B2"]},{"operation":"H","qubits":["A6"]},{"operation":"S","qubits":["A0"]},{"operation":"S","qubits":["A1"]},{"operation":"H","qubits":["A7"]},{"operation":"H","qubits":["A4"]},{"operation":"H","qubits":["A5"]},{"operation":"S","qubits":["A2"]},{"operation":"H","qubits":["B0"]},{"operation":"S","qubits":["B3"]},{"operation":"S","qubits":["B1"]},{"operation":"S","qubits":["A3"]},{"operation":"CNOT","qubits":["B0","A0"]},{"operation":"CNOT","qubits":["B3","A3"]},{"operation":"CNOT","qubits":["B2","A4"]},{"operation":"CNOT","qubits":["A7","A1"]},{"operation":"CNOT","qubits":["A2","A6"]},{"operation":"CNOT","qubits":["A5","B1"]},{"operation":"S","qubits":["B0"]},{"operation":"H","qubits":["A0"]},{"operation":"S","qubits":["B3"]},{"operation":"S","qubits":["A3"]},{"operation":"H","qubits":["B2"]},{"operation":"H","qubits":["A4"]},{"operation":"H","qubits":["A7"]},{"operation":"H","qubits":["A1"]},{"operation":"H","qubits":["A2"]},{"operation":"S","qubits":["A6"]},{"operation":"S","qubits":["A5"]},{"operation":"H","qubits":["B1"]},{"operation":"CNOT","qubits":["B1","A4"]},{"operation":"CNOT","qubits":["A6","A1"]},{"operation":"CNOT","qubits":["B3","B2"]},{"operation":"CNOT","qubits":["B0","A5"]},{"operation":"CNOT","qubits":["A2","A0"]},{"operation":"CNOT","qubits":["A3","A7"]},{"operation":"H","qubits":["B1"]},{"operation":"S","qubits":["A4"]},{"operation":"H","qubits":["A6"]},{"operation":"S","qubits":["A1"]},{"operation":"S","qubits":["B3"]},{"operation":"S","qubits":["B2"]},{"operation":"S","qubits":["B0"]},{"operation":"S","qubits":["A5"]},{"operation":"H","qubits":["A2"]},{"operation":"H","qubits":["A0"]},{"operation":"H","qubits":["A3"]},{"operation":"H","qubits":["A7"]},{"operation":"CNOT","qubits":["B3","A0"]},{"operation":"CNOT","qubits":["B1","A5"]},{"operation":"CNOT","qubits":["B2","A6"]},{"operation":"CNOT","qubits":["A1","A2"]},{"operation":"CNOT","qubits":["A3","A7"]},{"operation":"CNOT","qubits":["B0","A4"]},{"operation":"H","qubits":["B3"]},{"operation":"S","qubits":["A0"]},{"operation":"S","qubits":["B1"]},{"operation":"H","qubits":["A5"]},{"operation":"S","qubits":["B2"]},{"operation":"S","qubits":["A6"]},{"operation":"S","qubits":["A1"]},{"operation":"H","qubits":["A2"]},{"operation":"S","qubits":["A3"]},{"operation":"H","qubits":["A7"]},{"operation":"H","qubits":["B0"]},{"operation":"H","qubits":["A4"]},{"operation":"CNOT","qubits":["A0","A1"]},{"operation":"CNOT","qubits":["B2","A3"]},{"operation":"CNOT","qubits":["A4","B1"]},{"operation":"CNOT","qubits":["B0","A2"]},{"operation":"CNOT","qubits":["A7","A5"]},{"operation":"CNOT","qubits":["A6","B3"]}],"support_inverse_policy":"moore_penrose_on_exact_stabilizer_support","transpose_convention":"P_transpose_on_reference_Y_transpose_minus_Y"}
