{"accessible_partition":["E0","E1","E2","E3","A0","B0"],"allowed_gates":["H","S","X","Z","CNOT"],"ancilla_initial_stabilizers":[{"operators":"XIIIXIII","phase_exponent_mod_4":0,"qubit_order":["B0","B1","B2","B3","E0","E1","E2","E3"]},{"operators":"ZIIIZIII","phase_exponent_mod_4":0,"qubit_order":["B0","B1","B2","B3","E0","E1","E2","E3"]},{"operators":"IXIIIXII","phase_exponent_mod_4":0,"qubit_order":["B0","B1","B2","B3","E0","E1","E2","E3"]},{"operators":"IZIIIZII","phase_exponent_mod_4":0,"qubit_order":["B0","B1","B2","B3","E0","E1","E2","E3"]},{"operators":"IIXIIIXI","phase_exponent_mod_4":0,"qubit_order":["B0","B1","B2","B3","E0","E1","E2","E3"]},{"operators":"IIZIIIZI","phase_exponent_mod_4":0,"qubit_order":["B0","B1","B2","B3","E0","E1","E2","E3"]},{"operators":"IIIXIIIX","phase_exponent_mod_4":0,"qubit_order":["B0","B1","B2","B3","E0","E1","E2","E3"]},{"operators":"IIIZIIIZ","phase_exponent_mod_4":0,"qubit_order":["B0","B1","B2","B3","E0","E1","E2","E3"]}],"ancilla_qubits":["B0","B1","B2","B3","E0","E1","E2","E3"],"certification_thresholds":{"numerical_tolerance":"1e-12"},"channel_input":["A0"],"choi_convention":"normalized_bell_source_order_output_reference_environment","coupling_graph":{"directed":false,"edges":[["A0","B0"],["A0","E3"],["E0","E1"],["E1","E2"],["E2","E3"]],"native_two_qubit_gate":"CNOT","sites":["E0","E1","E2","E3","A0","B0"]},"depth_convention":"asap_two_qubit_layers_single_qubit_free","expected_tau_support":[],"format_version":"orelia.recovery-problem/v1","inaccessible_partition":["B1","B2","B3"],"logical_qubit_order":["A0"],"metadata":[["adapter","hayden_preskill_toy"],["architecture","chain"],["emission_time","2"],["fixture_id","a1"],["scramble_depth","6"],["seed","20260802"]],"petz_reference":"maximally_mixed_on_channel_input","physical_initial_order":["E0","E1","E2","E3","A0","B0"],"qubit_order":["A0","B0","B1","B2","B3","E0","E1","E2","E3"],"requested_output":["E0"],"router":{"algorithm":"common_lookahead_token_restore","candidate_budget":64,"lookahead":16,"restore_final_order":true},"source_clifford":[{"operation":"H","qubits":["A0"]},{"operation":"H","qubits":["B0"]},{"operation":"S","qubits":["B1"]},{"operation":"S","qubits":["B2"]},{"operation":"H","qubits":["B3"]},{"operation":"CNOT","qubits":["A0","B2"]},{"operation":"CNOT","qubits":["B0","B3"]},{"operation":"H","qubits":["A0"]},{"operation":"H","qubits":["B2"]},{"operation":"H","qubits":["B0"]},{"operation":"S","qubits":["B3"]},{"operation":"S","qubits":["B1"]},{"operation":"CNOT","qubits":["B3","B1"]},{"operation":"CNOT","qubits":["A0","B2"]},{"operation":"H","qubits":["B3"]},{"operation":"H","qubits":["B1"]},{"operation":"S","qubits":["A0"]},{"operation":"H","qubits":["B2"]},{"operation":"H","qubits":["B0"]},{"operation":"CNOT","qubits":["B3","B1"]},{"operation":"CNOT","qubits":["A0","B0"]},{"operation":"H","qubits":["B3"]},{"operation":"S","qubits":["B1"]},{"operation":"H","qubits":["A0"]},{"operation":"H","qubits":["B0"]},{"operation":"S","qubits":["B2"]},{"operation":"CNOT","qubits":["B1","B0"]},{"operation":"CNOT","qubits":["B2","A0"]},{"operation":"H","qubits":["B1"]},{"operation":"H","qubits":["B0"]},{"operation":"H","qubits":["B2"]},{"operation":"H","qubits":["A0"]},{"operation":"H","qubits":["B3"]},{"operation":"CNOT","qubits":["B2","B3"]},{"operation":"CNOT","qubits":["B0","A0"]},{"operation":"H","qubits":["B2"]},{"operation":"S","qubits":["B3"]},{"operation":"H","qubits":["B0"]},{"operation":"S","qubits":["A0"]},{"operation":"S","qubits":["B1"]},{"operation":"CNOT","qubits":["B0","B2"]},{"operation":"CNOT","qubits":["A0","B1"]}],"support_inverse_policy":"moore_penrose_on_exact_stabilizer_support","transpose_convention":"P_transpose_on_reference_Y_transpose_minus_Y"}
